{
  "name": "Blockbuster Ultimate v5",
  "version": "5.0",
  "libraries": [
    {
      "id": "1",
      "name": "Films",
      "type": "movie",
      "weight": 100.0
    }
  ],
  "time_blocks": [
    {
      "name": "morning_family_blockbuster",
      "start_time": "07:00",
      "end_time": "14:00",
      "criteria": {
        "preferred_types": ["movie"],
        "allowed_types": ["movie", "episode"],
        "excluded_types": [],
        "preferred_genres": ["Family", "Animation", "Adventure", "Comedy", "Fantasy"],
        "allowed_genres": ["Family", "Animation", "Adventure", "Comedy", "Fantasy", "Musical", "Romance", "Biography", "History"],
        "forbidden_genres": ["Horror", "Thriller", "Crime", "War", "Mystery"],
        "min_duration_min": 60,
        "max_duration_min": 180,
        "max_age_rating": "PG-13",
        "min_tmdb_rating": 6.5,
        "preferred_tmdb_rating": 7.5,
        "min_vote_count": 500
      }
    },
    {
      "name": "prime_time_blockbuster",
      "start_time": "14:00",
      "end_time": "20:00",
      "criteria": {
        "preferred_types": ["movie"],
        "allowed_types": ["movie", "episode"],
        "excluded_types": [],
        "preferred_genres": ["Action", "Adventure", "Science Fiction", "Fantasy", "Thriller"],
        "allowed_genres": ["Action", "Adventure", "Science Fiction", "Fantasy", "Thriller", "Comedy", "Romance", "Crime", "Mystery"],
        "forbidden_genres": ["Horror", "Documentary"],
        "min_duration_min": 80,
        "max_duration_min": 200,
        "max_age_rating": "R",
        "min_tmdb_rating": 7.0,
        "preferred_tmdb_rating": 8.0,
        "min_vote_count": 1000
      }
    },
    {
      "name": "premium_cinema_blockbuster",
      "start_time": "20:00",
      "end_time": "07:00",
      "criteria": {
        "preferred_types": ["movie"],
        "allowed_types": ["movie", "episode"],
        "excluded_types": [],
        "preferred_genres": ["Drama", "Thriller", "Crime", "Science Fiction", "Mystery", "Biography", "History", "War"],
        "allowed_genres": ["Drama", "Thriller", "Crime", "Science Fiction", "Mystery", "Action", "Biography", "History", "War", "Horror"],
        "forbidden_genres": ["Family", "Animation"],
        "min_duration_min": 90,
        "max_duration_min": 240,
        "min_tmdb_rating": 7.5,
        "preferred_tmdb_rating": 8.5,
        "min_vote_count": 2000
      }
    }
  ],
  "mandatory_forbidden_criteria": {
    "mandatory": {
      "content_ids": [],
      "min_duration_min": 60,
      "min_tmdb_rating": 6.0,
      "required_genres": []
    },
    "forbidden": {
      "content_ids": [],
      "types": ["trailer"],
      "keywords": ["xxx", "adult only", "porn"],
      "genres": []
    }
  },
  "strategies": {
    "maintain_sequence": false,
    "maximize_variety": true,
    "marathon_mode": false,
    "filler_insertion": {
      "enabled": false,
      "types": ["trailer"]
    },
    "bonuses": {
      "holiday_bonus": false,
      "recent_release_bonus": true
    }
  },
  "scoring_weights": {
    "type": 15.0,
    "duration": 15.0,
    "genre": 20.0,
    "timing": 10.0,
    "strategy": 5.0,
    "age": 15.0,
    "rating": 15.0,
    "filter": 5.0,
    "bonus": 5.0
  },
  "default_iterations": 10,
  "default_randomness": 0.3,
  "labels": ["blockbuster", "movies", "24h"]
}
